corpus_id,file_id,token_id,sentence,token,begin,end
biomed,BMC Neurosci-5-_-539297.nxml,2,"Indeed, CLN3 overexpression in HEK-293 cells altered lysosomal pH and cathepsin D processing [17], and lysosomal pH homeostasis is disrupted in JNCL [10,15].",processing,308,318
biomed,BMC Neurosci-6-_-1087847.nxml,17,"In addition to their expression in brain, both Annexin A7 isoforms have only been described in heart muscle and red blood cells [5-8].",heart,2694,2699
biomed,PLoS Biol-2-8-509301.nxml,2,"The three members of the vertebrate TIF1 family (α, β, and γ) are large nuclear proteins that each contain an N-terminal RBCC or TRIM domain (Reymond et al. 2001) composed of a RING finger, two B-boxes, and a coiled-coil domain.",proteins,393,401
biomed,BMC Biol-5-_-1858683.nxml,2,"In this report, we generated targeted mutations of Pygo1 and Pygo2 to determine their functions, with a particular interest in the contributions of these genes to canonical Wnt signaling during kidney development.",kidney,298,304
biomed,Arthritis Res Ther-9-1-1860061.nxml,5,The second approach is investigating candidate genes using both mouse and human studies.,studies,479,486
biomed,PLoS Biol-3-5-1110896.nxml,3,"In this study, we have used mouse genetics to test this general idea, by investigating whether the precise timing of onset of ETS transcription factor signaling is essential for normal sensory neuron development.",neuron,537,543
biomed,PLoS Genet-3-6-1904370.nxml,6,"We were unable to amplify the deletion-specific fragment in the family member of unknown affection status, or in 275 neurologically normal controls.",affection,1075,1084
biomed,PLoS Biol-2-12-529315.nxml,1,Neurotrophin-3 (NT-3) is a key requirement for the development of proprioceptive inputs to motor neurons (Chen and Frank 1999; Chen et al. 2003).,Frank,115,120
biomed,BMC Neurosci-6-_-548520.nxml,7,This synapse is characterized by the presence of a ribbon in the presynaptic cytoplasm.,cytoplasm,793,802
biomed,PLoS Genet-3-8-1959384.nxml,1,"TRIP13 was originally discovered to be an interactor with rat thyroid receptor beta (THRB; [54]), but the relationship between THRB and TRIP13 in meiosis is unknown.",receptor,70,78
biomed,PLoS Med-2-12-1322285.nxml,3,"In all animals harboring amyloid deposits, we found that the vast majority of Aβ (>99%) was extracted into the SDS and FA fractions (Figure 5A and 5B).",SDS,495,498
biomed,PLoS Med-2-12-1322285.nxml,7,"In fact, levels of PBS-soluble Aβ40 and Aβ42 in the 6 mo + 3 mo and 6 mo + 6 mo treated cohorts were most similar to that of the 9 mo untreated cohort, suggesting that age, as opposed to synthetic rate (which would be negligible in the treated animals), may determine the fraction of PBS-soluble Aβ in these animals.",rate,1194,1198
biomed,PLoS Biol-3-1-539061.nxml,2,"Both activity of Snail and down-regulation of E-cadherin play pivotal roles in epithelial to mesenchymal transitions (EMTs), typified by the transformation of polarized, adhering epithelial cells into motile mesenchymal cells [16,17].",play,341,345
biomed,BMC Med Genet-7-_-1448208.nxml,14,"From the characterization studies completed thus far, the null mutation mouse accurately represents a model of classic MSUD and appears to be a faithful model of the human disease with respect to several biochemical phenotypes [1].",respect,1786,1793
biomed,PLoS Genet-2-11-1657042.nxml,12,"Instead, DAPI staining was diffuse within the nucleus, with regions of higher density around the nucleoli and at the periphery of the nuclei (Figure 1D).",Figure,1755,1761
biomed,BMC Dev Biol-6-_-1382200.nxml,3,"The μ-80 k and m-80 k subunits share 62% amino acid sequence identity, and are very similar in terms of structure, protein chemistry, and in vitro substrate specificity.",chemistry,547,556
biomed,Arthritis Res Ther-8-2-1526604.nxml,2,Linkages for human RA have been found in this particular region [24].,Linkages,99,107
biomed,PLoS Genet-3-6-1904370.nxml,1,"Given our interest in human neurological disease we sought to identify any cognate human disorders where linkage had been established to the syntenic region of the human genome, but where no causal mutation had been identified.",genome,170,176
biomed,BMC Genomics-5-_-340383.nxml,11,"In current study, the Acdp1 C-terminus antibody only recognizes Acdp1 in brain tissue extracts as well as in HEK293, 3T3 and PC12 cell lysates, suggesting the specificity of the antibody.",cell,1379,1383
biomed,PLoS Genet-2-2-1378123.nxml,3,"This study improved on past models by including over 300 animals (three times the size of previous studies) of both sexes, allowing for the incorporation of sex-specific effects on underlying genetic regulation.",times,440,445
biomed,BMC Dev Biol-6-_-1382200.nxml,2,Initial studies targeted Capn4 based on the prediction that loss of this calpain subunit would abolish activity of both μ- and m-calpain.,activity,288,296
biomed,BMC Genet-6-_-1208879.nxml,4,"Since receptor activation causes dissociation of HOMER proteins [35], PAX6 may be released as a result of synaptic activity, allowing it to interact with DNCL1.",dissociation,411,423
biomed,BMC Med-2-_-394351.nxml,5,"Another prediction, based upon the enzyme and mRNA levels in knockout mice, is that if these mice are placed on a high cholesterol/high sitosterol diet, they may show significant accumulation of both sterols in the body.",enzyme,740,746
biomed,BMC Dev Biol-4-_-341451.nxml,6,"Thus, it is possible that the cholesterol levels (roughly 50% of normal levels) in Dhcr7-/- embryos were enough for completion of Shh autoprocessing or 7DHC accumulated in Dhcr7-/- embryonic tissues can also participate efficiently as a sterol adduct in the Shh processing reaction [20].",completion,1149,1159
biomed,PLoS Biol-2-8-509305.nxml,7,"Furthermore, the region on Chromosome 7 associated with the development of lupus nephritis has been linked to the same trait in other murine models of SLE (Santiago et al. 1998; Morel et al. 1999; Xie et al. 2002), suggesting the possibility of shared susceptibility loci.",models,1064,1070
biomed,PLoS Genet-1-2-1193529.nxml,5,"Interestingly, AVPR2-deficient male pups also die within the first week after birth.",week,398,402
biomed,PLoS Genet-1-2-1193530.nxml,6,"Under cold challenge conditions, however, MCAD−/− mice were unable to maintain body temperature.",conditions,774,784
biomed,PLoS Biol-2-10-509410.nxml,5,"Thus, PPARδ activation, rather than merely an increase of PPARδ levels, is an essential element for fiber switching and its associated functional manifestations.",element,909,916
biomed,Arthritis Res Ther-8-2-1526604.nxml,5,"In fact, this situation gave an opportunity to study the genetic control of arthritis in aged multiparous females, a common situation in human RA.",fact,807,811
biomed,PLoS Genet-1-6-1342629.nxml,4,"However, two thirds of the Sam68−/−, but not the Sam68+/- pups, were killed by their Sam68+/- mothers.",pups,496,500
biomed,BMC Dev Biol-4-_-341451.nxml,3,"Although no embryonic lethality was noted, these knockout pups exhibited a number of developmental abnormalities and died within 24 h after birth.",abnormalities,341,354
biomed,J Biol-3-4-549712.nxml,2,"Its nuclear localization is mediated by five independent nuclear localization signals, each of which alone is capable of targeting Ptdsr to the cell nucleus [29].",signals,135,142
biomed,BMC Genet-6-_-1208879.nxml,2,"All our data are consistent with the hypothesis that TRIM11 does not interact with the C-terminal peptide, but interacts with the PST domain between the homeodomain and the C-terminal peptide.",PST,288,291
biomed,PLoS Biol-3-5-1110896.nxml,1,"The differentiation of sensory neurons of dorsal root ganglia (DRG) has been studied extensively with respect to inductive events that specify neuronal fate [2,3], as well as the involvement of late target-derived neurotrophic factors in the control of neuronal survival [4].",factors,227,234
biomed,BMC Med-2-_-516044.nxml,1,The onset of pendrin expression during development of the mouse inner ear has been determined to be embryonic day (ED) 13 [14].,ED,115,117
biomed,BMC Med-2-_-394351.nxml,1,"The major findings in this study are: (1) disruption of only one of the two genes comprising the STSL locus is necessary and sufficient to cause sitosterolemia, (2) that the loss of Abcg8/sterolin-2 leads to the loss of biliary cholesterol secretion and (3) Abcg5/sterolin-1 appears to be still apically-expressed despite the absence of Abcg8/sterolin-2.",cholesterol,228,239
biomed,PLoS Genet-2-12-1756909.nxml,14,"In addition to BMP2 and BMP7, a third member of this family that is closely related to BMP2, BMP4, is also expressed in the early limb bud.",family,1757,1763
biomed,BMC Biol-5-_-1858683.nxml,2,Mutual inductive interactions between the ureteric bud and metanephric mesenchyme drive nephrogenesis [1].,drive,163,168
biomed,Breast Cancer Res-3-5-138691.nxml,9,"Finally, genetic measurements of recombination frequency have shown that Brca1-/- embryonic stem (ES) cells are deficient in recombinational DSB repair [22,23].",repair,1336,1342
biomed,BMC Dev Biol-5-_-1208873.nxml,3,These will be important for implicating candidates to be assessed in the extraembryonic signals that determine anterior streak progression in the developing embryo and in delineating the dominant activity of the polyglutamine tract in huntingtin that determines the striatal specificity of HD.,specificity,802,813
biomed,BMC Dev Biol-5-_-1208873.nxml,3,"Our results support and refine the hypothesis, indicating that huntingtin is required for proper mesoderm patterning and for normal regional restriction of the expression of a subset of growth and transcription factors.",factors,682,689
biomed,BMC Dev Biol-6-_-1435744.nxml,4,"Polymerization of the SAM domain has been previously reported to be essential for the repressive functions of ph and TEL [43,44].",functions,491,500
biomed,PLoS Biol-2-1-314463.nxml,2,"In the embryo, alterations in the determination or migration of melanoblasts from the neural crest affect the number or distribution of pigment cells in the skin (reviewed in Reedy et al. 1998).",skin,243,247
biomed,PLoS Genet-3-8-1959384.nxml,3,"Of these four genes, SAE2 and ZIP1 do not have clear mammalian orthologs (although SYCP1 may be a functional ortholog of ZIP1), and mutation of the mouse RAD17 ortholog, Rad1, presumably causes embryonic lethality [42].",lethality,505,514
biomed,Nucleic Acids Res-33-18-1253828.nxml,3,"In addition, it is required for the metalloregulation of Znt1, encoding the major plasma membrane-localized zinc efflux transporter (19), the hypoxic/anoxic induction of the gene for placental growth factor (Plgf), an angiogenic protein of the vascular endothelial growth factor (VEGF) family (20), and has recently been invoked in tumor development (21,22).",transporter,363,374
biomed,PLoS Genet-3-4-1857728.nxml,5,The presence of Dmrt7 in both lineages may support a common origin for either the sex chromosomes or the sex chromatin of monotremes and other mammals.,chromosomes,704,715
biomed,BMC Neurosci-5-_-400732.nxml,1,Mice with or without intact dopamine D2R-mediated signaling displayed similar decreases in latencies to retrieve unhidden food pellets (Fig. 1) and learned to dig for food buried in unscented sand (Fig. 2).,pellets,127,134
biomed,BMC Genet-6-_-1208879.nxml,2,"IMH conceived, designed and supervised the study, and obtained funding.",funding,133,140
biomed,BMC Med-2-_-394351.nxml,4,"In experiments shown here, using three separately developed anti-Abcg5/sterolin-1 antibodies, we have obtained inconsistent data regarding the trafficking of Abcg5/sterolin-1 in Abcg8-/- mice.",antibodies,517,527
biomed,BMC Genet-6-_-1208879.nxml,3,"Other defects included absence or hypoplasia of the pineal gland, cortical polymicrogyria, white matter changes in the corpus callosum and grey matter changes in the cerebellum [11-13].",cerebellum,440,450
biomed,BMC Genet-2-_-48141.nxml,2,Identifying such loci allows screening for individuals with an increased risk of developing glaucoma [11].,risk,285,289
biomed,PLoS Med-2-12-1322285.nxml,3,An additional consideration we recognize is that a small amount of transgene expression continues in the presence of dox and that endogenous mouse Aβ continues to be produced.,amount,536,542
biomed,BMC Neurosci-5-_-400732.nxml,5,"[1,2] for review].",review,951,957
biomed,BMC Neurosci-5-_-400732.nxml,1,"In this study, we sought to determine the contribution of dopamine D2 receptor-mediated signaling to the various stages of associative and reversal learning.",learning,148,156
biomed,BMC Ophthalmol-3-_-149350.nxml,3,"Although actin filament formation has been shown to be necessary for differentiation of lens epithelial cells [15], the significance of alpha-crystallin's interaction with actin in differentiation is not known.",filament,213,221
biomed,PLoS Genet-1-6-1342629.nxml,1,The skeletal phenotyping of cohorts of Sam68+/+ and Sam68−/− mice showed that bone mass was preserved in aged Sam68−/− mice.,bone,78,82
biomed,BMC Dev Biol-4-_-341451.nxml,7,"It has been reported that inhibition of cholesterol biosynthesis by chemical inhibitors of Dhcr7 also led to a disturbance of the Shh signaling with abnormal embryogenesis [27,28], and severe sterol deprivation can indeed inhibit the processing of transfected Shh in cultured mammalian cells [29].",chemical,917,925
biomed,BMC Biochem-4-_-194730.nxml,1,"CH and CSC planned and carried out the experiments with the red blood cells and platelets and the fractionation studies and drafted the manuscript, GL was responsible for platelets, RK gave support on the ADVIA 120 cell counter, evaluated and discussed the results, SMP and BSG gave support on the APACT system, platelet aggregation experiments, and evaluated the results, CZ was responsible for the sorcin studies, MS studied the cytoskeletal activities of the protein, AAN conceived of the studies and participated in its design.",CH,0,2
biomed,BMC Neurosci-7-_-1420314.nxml,3,"We assume that these ADAMs might contribute to cell migration, differentiation and survival or synaptic regulation by binding to integrins, cell-surface proteins or intracellular signalling molecules [20,21].",signalling,445,455
biomed,Genome Biol-4-11-329117.nxml,3,"Olfactory receptors were originally identified in an elegant experiment based on the hypothesis that they would be seven-transmembrane-domain proteins encoded by a large, diverse gene family whose expression is restricted to the olfactory epithelium [3].",experiment,372,382
biomed,BMC Ophthalmol-3-_-149350.nxml,4,"Although this property may be a major contributor to the maintenance of lens clarity, the early changes in the alphaA/BKO lenses indicate a much broader cellular function for alpha-crystallin.",property,463,471
biomed,Breast Cancer Res-3-5-138691.nxml,5,"It is possible that RAD51 may alternatively be capable of BRCA2-independent transport, but mislocalization of BRCA2 to the cytoplasm may sequester RAD51 and block its normal mode of transport.",cytoplasm,830,839
biomed,BMC Blood Disord-6-_-1617083.nxml,1,"JHP conceived and designed the study, coordinated the experiments and drafted the manuscript.",manuscript,82,92
biomed,BMC Dev Biol-6-_-1382200.nxml,6,"It is generally assumed that μ- and m-calpain maintain their differential sensitivities to calcium in vivo, although this has not yet been strictly demonstrated.",sensitivities,1000,1013
biomed,PLoS Genet-1-2-1193530.nxml,2,MCAD-deficient patients have abnormal plasma and urine metabolites associated with the medium chain–length enzyme specificity.,enzyme,281,287
biomed,PLoS Genet-3-8-1959384.nxml,4,This response to meiotic defects is referred to as the “pachytene checkpoint” (reviewed in [5]).,defects,567,574
biomed,BMC Ophthalmol-3-_-149350.nxml,5,Beaded filament mRNA levels are greatly increased in differentiating lens epithelium and have been suggested as a pan-specific marker for lens fiber development [17].,filament,657,665
biomed,PLoS Genet-1-2-1193529.nxml,9,"For this process to occur, AVP binds its receptor, AVPR2, on the basolateral face of the collecting duct cells, leading to a rise in intracellular cAMP, ultimately resulting in phosphorylation of AQP2 at serine 256 by cAMP-dependent protein kinase [9] and its redistribution to the plasma membrane.",process,1423,1430
biomed,BMC Dev Biol-6-_-1435744.nxml,1,"SAM domains (also known as Pointed, HLH, or SPM domains) are ~70 residues long and have been reported as common protein-protein interaction modules [15-17].",modules,140,147
biomed,BMC Med-2-_-516044.nxml,2,"Dual labeling experiments demonstrated that pendrin is expressed in spindle-shaped cells, which are surface epithelial cells in stria vascularis adjacent to strial marginal cells near the borders of both the spiral prominence and Reissner's membrane (Fig. 1c).",borders,478,485
biomed,BMC Dev Biol-6-_-1382200.nxml,4,"Despite these similarities, the differential expression patterns of μ- and m-calpain in mammalian tissues suggest they have some isoform specific and distinct functions.",patterns,650,658
biomed,BMC Neurosci-5-_-539297.nxml,6,"Alternatively, or simultaneously, battenin deficiency may impact mitochondrial function upstream of turnover, affecting mitochondrial biogenesis and/or altered transport and processing of mitochondrial proteins.",processing,1052,1062
biomed,Nucleic Acids Res-34-13-1540739.nxml,1,These data report the development and implementation of an improved RMCE approach that enables efficient allele modification in ES cells to generate mice and in heterozygous MEFs to accelerate phenotypic analyses.,allele,105,111
biomed,Genome Biol-4-11-329117.nxml,15,"Transcription of apparent 'singleton' olfactory receptor genes (0.5 Mb or more from the nearest other olfactory receptor gene) suggests that there is no absolute requirement for genomic clustering for an olfactory receptor to be transcribed, consistent with observations that small olfactory receptor transgenes can be expressed correctly when integrated outside native olfactory receptor clusters [35].",Mb,2223,2225
biomed,PLoS Genet-2-2-1378123.nxml,2,"Apart from the obvious gender-specific diseases such as cervical or prostate cancer, sex influences susceptibility to nearly all highly prevalent diseases that affect both women and men, including atherosclerosis and diabetes and their precursor conditions of hyperlipidemia, obesity, and insulin resistance.",sex,209,212
biomed,BMC Dev Biol-6-_-1382200.nxml,1,"It should also be stressed that Capn4-/- ES and MEF cells from the presumptive hypomorphic allele can be maintained in culture despite an apparent lack of calpain activity, as assessed by casein zymography or by the appearance of characteristic spectrin breakdown products.",breakdown,254,263
biomed,PLoS Genet-1-2-1193529.nxml,1,"Immunostaining the kidneys of homozygous Aqp2F204V/F204V mice shows that the mutant-expressing collecting duct cells can not mediate water reabsorption, because it fails to insert into the apical plasma membrane in response to dDAVP.",duct,106,110
biomed,BMC Biochem-4-_-194730.nxml,4,Ca2+ also induces a transbilayer phospholipid redistribution inducing a shape change of red blood cells [51].,redistribution,466,480
biomed,Nucleic Acids Res-33-18-1253828.nxml,5,"In contrast, mice with null mutations for the stress-inducible metallothionein genes (Mt1 and Mt2) are viable, though sensitive to cadmium (24,25), indicating that additional important MTF-1 target genes are involved in the lethal phenotype.",cadmium,919,926
biomed,PLoS Biol-3-5-1110896.nxml,1,"To test the hypothesis that a temporal delay in the onset of transcriptional programs is crucial for the control of appropriate neuronal maturation, we studied the development of proprioceptive DRG neurons, since transcriptional effectors regulated by target-derived signals, as well as some of their downstream biological actions, have been identified for these neurons.",hypothesis,12,22
biomed,BMC Neurosci-7-_-1420314.nxml,9,These studies might clarify whether ADAM11 plays an important signalling or structural role at the synaptic level and whether it participates in synaptic regulation.,role,1943,1947
biomed,BMC Biotechnol-2-_-116589.nxml,3,The sequence of DsRed1 has recently been modified and optimized for high levels of expression in mammalian cells by the introduction of 144 silent base pair changes corresponding to human codon usage preferences.,sequence,454,462
biomed,PLoS Biol-2-11-523229.nxml,4,A better understanding of the molecular mechanisms that create and maintain articular cartilage is crucial for discovering the causes of joint disorders and providing useful medical treatments.,causes,634,640
biomed,BMC Blood Disord-6-_-1617083.nxml,5,"A recent study [25] of sheer stress in rats, found that the magnitude of changes in sheer stress with increased blood flow varied with the different strains.",flow,548,552
biomed,PLoS Genet-3-6-1904370.nxml,6,"Second, we cannot rule out the existence of an alternate start site for ITPR1 that may result in a product that confers a pathogenic gain of function to the protein; however, Western blot analysis of cells derived from affected AUS1 family members, which was performed using an antibody raised against the C-terminal portion of ITPR1, failed to identify any disease-specific truncated protein products.",start,915,920
biomed,BMC Med Genet-7-_-1448208.nxml,3,"However, we were unable to consistently turn off the human E2 expression cassette by the potent tetracycline analogue, doxycycline in either of the two transgenic lines tested (data not shown).",analogue,527,535
biomed,PLoS Biol-3-5-1110896.nxml,3,"Target-derived factors have also been implicated in controlling neuronal maturation of predetermined neurons in Drosophila, in which expression of members of the BMP family in the target region is essential for the induction of mature peptidergic properties in a subpopulation of neurons marked by the coordinate expression of the two transcription factors Apterous and Squeeze [11,12].",maturation,564,574
biomed,Arthritis Res Ther-9-1-1860061.nxml,4,"First, we performed the linkage analysis in three datasets, including all 290 F progeny, 76 C5+/+ F2 progeny and 133 C5+/- F2 progeny.",linkage,420,427
biomed,BMC Med Genet-7-_-1448208.nxml,5,"In addition to testing various treatments, these models should also be very useful for investigating the underlying pathophysiologic consequences of the disease.",treatments,719,729
biomed,PLoS Genet-2-12-1756909.nxml,11,"By the time its expression is first detectable, the floxed Bmp2 allele appears to be completely recombined in the limb mesenchyme, as whole mount in situ hybridization does not detect any mesenchymal Bmp2 transcription (Figure 1B).",transcription,1531,1544
biomed,BMC Dev Biol-4-_-341451.nxml,4,"Instead, a distinct lung hypoplasia at the saccular stage, characterized by arrested or partially developed distal epithelial tubules, reduced terminal sac space, delayed type I AECs differentiation and delayed vascular development, was consistently observed at late gestational stages in Dhcr7-/- embryos.",tubules,525,532
biomed,BMC Med-2-_-516044.nxml,7,"In addition, we observed an apparent degeneration of stria vascularis, including an increase in pigmentation and an irregular pattern of the tight junctions of marginal cells (Fig. 2c, 6,7).",pigmentation,990,1002
biomed,Breast Cancer Res-3-5-138691.nxml,3,"In the absence of this interaction with BRCA2, RAD51 might exist in a form that is not capable of being recruited into a functional repair complex when damage occurs.",complex,517,524
biomed,Arthritis Res Ther-9-1-1860061.nxml,11,This suggests that there must be other susceptibility genes whose contributions were not big enough to reach the stringent significance threshold value of linkage analysis.,susceptibility,1323,1337
biomed,PLoS Biol-3-5-1110896.nxml,4,"Thus, both in Drosophila and vertebrates, target-derived factors appear to act permissively to induce the expression of transcriptional programs involved in terminal neuronal maturation.",maturation,1053,1063
biomed,BMC Neurosci-7-_-1420314.nxml,5,"A genome database search revealed orthologs of ADAM11, ADAM22 and ADAM23 genes to exist in vertebrates such as mammals, fish, and amphibians, but not in invertebrates.",invertebrates,664,677
biomed,PLoS Biol-3-4-1074790.nxml,4,"Similarly, cardiac performance of PGC-1α−/− mice was compromised following severe exertion.",exertion,522,530
biomed,PLoS Genet-1-2-1193523.nxml,3,Further support for this idea has been provided by recent work in our lab showing widespread derepression of cone genes in the Notch1−/− retina (unpublished data).,idea,436,440
biomed,PLoS Med-2-12-1322285.nxml,5,"Other studies have dealt with similar problems by excluding animals that do not show adequate attention to the task, retaining only those mice that meet certain performance criteria [30].",performance,781,792
biomed,J Biol-3-4-549712.nxml,3,"In vertebrates, a number of receptors have been identified that can mediate phagocytosis of apoptotic cells.",vertebrates,422,433
biomed,PLoS Genet-1-2-1193530.nxml,4,"Because there was clearly no MCAD antigen detected in MCAD−/− mice, the residual dehydrogenase activity measured with these two substrates must represent the activity of other chain length–specific acyl-CoA dehydrogenases.",length,506,512
biomed,PLoS Med-2-12-1322285.nxml,2,"Unfortunately, efforts to characterize cognitive behavior were compromised by severe hyperactivity in untreated double transgenic mice.",behavior,240,248
biomed,PLoS Med-2-12-1322285.nxml,5,Many of the double transgenic mice showed similar circular patterns of swimming near the edge of the tank when tested in the Morris water maze.,Morris,771,777
